{
  "schema_version": "0.1",
  "feedback": {"id": "feedback-2026-07-31-task-blocking", "workspace_release": "0.1.0", "source_fingerprint": "d9f429f2e0a3e8f88612e3b5aa03a7390afb5c6d50e228d8690f0acb7f0eb3c1", "redaction_confirmed": true, "created_at": "2026-07-31T12:00:00+08:00"},
  "collection": {"mode": "periodic", "authorized_sources": ["task-records", "workspace-control-plane"]},
  "candidates": [{"id": "task-blocking-evidence", "kind": "specification", "area": "task-lifecycle", "scope": "standard-candidate", "title": "记录外部阻塞的原因与证据", "summary": "多个已完成任务需要保留外部阻塞及恢复条件，现有任务状态无法结构化表达。", "confidence": "confirmed", "occurrences": 3, "evidence": [{"kind": "task", "summary": "已脱敏任务记录显示同一状态缺口重复出现。"}, {"kind": "review", "summary": "复盘确认该结论不依赖项目术语或本机环境。"}]}]
}
